{
  "request_id": "req_contract_001",
  "actor": {
    "actor_type": "ai_agent",
    "actor_id": "agent_001"
  },
  "source": {
    "channel": "api",
    "client_id": "client_001"
  },
  "inputs": {},
  "context": {},
  "correlation": {
    "trace_id": "trace_contract_001",
    "correlation_id": "corr_contract_001"
  },
  "timestamps": {
    "requested_at": "2026-05-23T08:30:00Z"
  }
}
